[
  {
    "id": "src:resume-2026-08",
    "kind": "repo-git",
    "repo": "target",
    "label": "Resume source as Duy last hand-edited it (git object, pre-migration)",
    "locator": "git show 234cbcd:docs/resume_content.html",
    "custodian": "public",
    "trust": "self-reported",
    "firstRecorded": "2026-09-02",
    "lastChecked": "2026-09-02",
    "note": "Deliberately a GIT OBJECT, not the working-tree file. scripts/gen-resume.mjs now regenerates public/docs/resume_content.html FROM this corpus, so citing the live file as evidence for a claim would be circular: the claim would be sourced to a document the claim wrote. The frozen 234cbcd object is the last hand-authored version and is permanent."
  },
  {
    "id": "src:portfolio-2026-08",
    "kind": "repo-git",
    "repo": "target",
    "label": "Previous portfolio homepage (deleted in the rebuild; git object)",
    "locator": "git show 234cbcd:docs/index_portfolio.html",
    "custodian": "public",
    "trust": "self-reported",
    "firstRecorded": "2026-09-02",
    "lastChecked": "2026-09-02",
    "note": "docs/index_portfolio.html no longer exists in the working tree — the rebuild deletes it and 308s the URL to /. It survives as a git object and is cited that way so every claim that rested on it stays checkable."
  },
  {
    "id": "src:news-html",
    "kind": "repo-file",
    "repo": "target",
    "label": "Dated research news archive",
    "locator": "public/docs/news.html",
    "custodian": "public",
    "trust": "self-reported",
    "firstRecorded": "2026-09-02",
    "lastChecked": "2026-09-02",
    "note": "The most granular and most dated record of the research work; its entries carry months, which is where period precision on the Yang claims comes from. Its April 2026 entry also carries the STALE Fischer paragraph (MySQL / 110 neurons / 8 owls / 14,000 files / 261 experiments / 228 loads) that Addendum A.1 retires — that paragraph is cited only by retraction records, never as evidence."
  },
  {
    "id": "src:mosaic-html",
    "kind": "repo-file",
    "repo": "target",
    "label": "MOSAIC chatbot project page",
    "locator": "public/docs/index_mosaic_chatbot.html",
    "custodian": "public",
    "trust": "self-reported",
    "firstRecorded": "2026-09-02",
    "lastChecked": "2026-09-02"
  },
  {
    "id": "src:mosaic-infographic",
    "kind": "owner-archive",
    "repo": null,
    "label": "\"Projected MOSAIC Chatbot Impact\" infographic (Duy's own EDIJ application document)",
    "locator": "/Users/dcnguyen060899/Downloads/MOSAIC_project/EDIJ application/Mosaic_Chatbot_Impact_Infographic (4).pdf",
    "custodian": "Duy",
    "trust": "primary",
    "firstRecorded": "2026-09-02",
    "lastChecked": "2026-09-02",
    "note": "THE DOCUMENT THAT CLOSED THE 660,000 QUESTION. Its own title is 'PROJECTED MOSAIC CHATBOT IMPACT'. Extracted verbatim: '660 000 RECORDED WEBSITE VISITS — MOSAIC ANNUAL REPORT 2022'. Its 90 / 64 / 38 percent figures are cited industry statistics (MIT Technology Review 2023; Salesforce 2019), not measurements of this project."
  },
  {
    "id": "src:mosaic-neo4j-data",
    "kind": "owner-archive",
    "repo": null,
    "label": "MOSAIC Neo4j entity and relationship CSVs",
    "locator": "/Users/dcnguyen060899/Downloads/MOSAIC_project/MOSAIC-2/redesign dataframe/neo4j_data/",
    "custodian": "Duy",
    "trust": "primary",
    "firstRecorded": "2026-09-02",
    "lastChecked": "2026-09-02",
    "note": "Six entity files (Programs, Locations, ClientNeeds, AgeGroups, ImmigrationStatus, OtherServices) and five ProgramTo* relationship files. Direct evidence of the knowledge-graph modelling, independent of any usage figure."
  },
  {
    "id": "src:mosaic-handoff",
    "kind": "owner-archive",
    "repo": null,
    "label": "MOSAIC product and handoff documentation",
    "locator": "/Users/dcnguyen060899/Downloads/MOSAIC_project/MOSAIC-3/ (PRD, Design Sprint, Handoff documentation, Developer Documentation, Meeting Notes)",
    "custodian": "Duy",
    "trust": "primary",
    "firstRecorded": "2026-09-02",
    "lastChecked": "2026-09-02"
  },
  {
    "id": "src:sfu-rec-letter",
    "kind": "owner-archive",
    "repo": null,
    "label": "Signed client endorsement letter — MOSAIC BC to the SFU Computing Science Diversity Committee, supporting the student team's project",
    "locator": "/Users/dcnguyen060899/Downloads/MOSAIC_project/Recommendation Letter_SFU_Signed.pdf",
    "custodian": "Duy",
    "trust": "primary",
    "firstRecorded": "2026-09-02",
    "lastChecked": "2026-09-02",
    "note": "MISLABELLED UNTIL 2026-09-02. The filename says 'Recommendation Letter_SFU_Signed' and the corpus previously described it as a recommendation letter FROM Simon Fraser University. It is neither. It is written by Kumar Lal, Director of Business Technology and Operations at MOSAIC BC — the CLIENT — and addressed TO the SFU Computing Science Diversity Committee. It endorses 'the students' project' throughout, in the plural, and names no individual. It is evidence the client valued the team's work; it is not a personal reference for Duy and must never be rendered as one."
  },
  {
    "id": "src:data5100-html",
    "kind": "repo-file",
    "repo": "target",
    "label": "NASA flight-recorder project page (DATA 5100 final project)",
    "locator": "public/docs/index_data5100_project.html",
    "custodian": "public",
    "trust": "self-reported",
    "firstRecorded": "2026-09-02",
    "lastChecked": "2026-09-02",
    "note": "Labels the figure correctly as '95.9% Variance Explained (R2)' at lines 55-56. The 'predictive accuracy' mislabel lived on the deleted homepage, not here."
  },
  {
    "id": "src:imgclass-html",
    "kind": "repo-file",
    "repo": "target",
    "label": "Garbage-classification project page",
    "locator": "public/docs/index_image_classification.html",
    "custodian": "public",
    "trust": "self-reported",
    "firstRecorded": "2026-09-02",
    "lastChecked": "2026-09-02",
    "note": "Its course label is wrong — see dsp:data5100-label. The model results are unaffected."
  },
  {
    "id": "src:capstone-html",
    "kind": "repo-file",
    "repo": "target",
    "label": "UC Berkeley ML/AI capstone project page",
    "locator": "public/docs/index.html",
    "custodian": "public",
    "trust": "self-reported",
    "firstRecorded": "2026-09-02",
    "lastChecked": "2026-09-02",
    "note": "Carries the exact figure $30,388,400 and the 80% model accuracy. It does NOT contain the string '180' anywhere — which is why the '180K+ patient records' claim is retracted as unsourced rather than merely rounded."
  },
  {
    "id": "src:blog-html",
    "kind": "repo-file",
    "repo": "target",
    "label": "Essay: \"AI Didn't Take Your Job. It Created One Nobody Is Trained For\"",
    "locator": "app/essays/the-scarce-complement/page.tsx",
    "custodian": "public",
    "trust": "self-reported",
    "firstRecorded": "2026-09-02",
    "lastChecked": "2026-09-21"
  },
  {
    "id": "src:su-catalog",
    "kind": "institutional-catalog",
    "repo": null,
    "label": "Seattle University 2026-2027 Graduate Catalog, M.S. Data Science",
    "locator": "https://catalog.seattleu.edu/",
    "custodian": "public",
    "trust": "primary",
    "firstRecorded": "2026-09-02",
    "lastChecked": "2026-09-02",
    "note": "The only primary-trust source for the curriculum: course titles, credit counts and course numbers come from here and nowhere else. NOTE: the catalog is evidence about the PROGRAMME, never about what Duy personally completed — that requires a syllabus, a transcript or an artifact."
  },
  {
    "id": "src:cpsc5330-syllabus",
    "kind": "owner-archive",
    "repo": null,
    "label": "CPSC 5330 01 26SQ Big Data Analytics — course syllabus / home page (PDF)",
    "locator": "/Users/dcnguyen060899/Downloads/CPSC_5330/introduction/CPSC 5330 01 26SQ Big Data Analytics.pdf",
    "custodian": "Duy",
    "trust": "primary",
    "firstRecorded": "2026-09-02",
    "lastChecked": "2026-09-02",
    "note": "Section 26SQ (Spring Quarter 2026), Seattle University, Thursdays 18:00-20:40, BANN 371, Canvas shell seattleu.instructure.com/courses/1632885. Names the actual infrastructure: AWS LearnerLab, an EC2 Hadoop instance from an AMI, WSL, Java + Maven, SSH/PEM."
  },
  {
    "id": "src:cpsc5330-tf",
    "kind": "owner-archive",
    "repo": null,
    "label": "CPSC 5330 term-frequency pipeline (Homework 3 artifact)",
    "locator": "/Users/dcnguyen060899/Downloads/CPSC_5330/w5/term-frequency/ (also w5/term-frequency.zip, 12 entries)",
    "custodian": "Duy",
    "trust": "primary",
    "firstRecorded": "2026-09-02",
    "lastChecked": "2026-09-02",
    "note": "Authored 2026-05-04 to 2026-05-06 (file mtimes and zip entry timestamps). job1/{mapper,reducer}.py, job2/{mapper,reducer}.py, tf.hql, main.sh, job1.sh, job2.sh, README.md. Inspectable, dated code."
  },
  {
    "id": "src:cpsc5330-hw",
    "kind": "owner-archive",
    "repo": null,
    "label": "CPSC 5330 Homework 3 and Homework 4 assignment sheets",
    "locator": "/Users/dcnguyen060899/Downloads/CPSC_5330/w5/Homework 3.pdf and /Users/dcnguyen060899/Downloads/CPSC_5330/W7/Homework 4.pdf",
    "custodian": "Duy",
    "trust": "primary",
    "firstRecorded": "2026-09-02",
    "lastChecked": "2026-09-02",
    "note": "HW3 due Thu May 7 2026 22:00; HW4 due Thu May 21 2026 22:00. These due dates are what fix the term to Spring Quarter 2026 independently of the syllabus header."
  },
  {
    "id": "src:cpsc5330-decks",
    "kind": "owner-archive",
    "repo": null,
    "label": "CPSC 5330 weekly lecture decks",
    "locator": "/Users/dcnguyen060899/Downloads/CPSC_5330/ (w5/5 AWS EMR.pdf, W7/6 TF-IDF & DynamoDB.pdf, w8/7 Spark & RDD.pdf, w9/8 Spark SQL & DataFrames.pdf, w10/9 Streaming.pdf)",
    "custodian": "Duy",
    "trust": "primary",
    "firstRecorded": "2026-09-02",
    "lastChecked": "2026-09-02"
  },
  {
    "id": "src:iccl-db",
    "kind": "owner-archive",
    "repo": null,